{
  "catalog": {
    "prices": [
      {
        "amount": 10,
        "currency": "BONAT",
        "sku_id": "change_bag",
        "sku_kind": "booster"
      },
      {
        "amount": 12,
        "currency": "BONAT",
        "sku_id": "ledger_peek",
        "sku_kind": "booster"
      },
      {
        "amount": 8,
        "currency": "BONAT",
        "sku_id": "traffic_jam",
        "sku_kind": "booster"
      },
      {
        "amount": 8,
        "currency": "BONAT",
        "sku_id": "wake_all",
        "sku_kind": "booster"
      },
      {
        "amount": 900,
        "currency": "JENEHAT",
        "sku_id": "ch3_shabka",
        "sku_kind": "chapter"
      },
      {
        "amount": 30,
        "currency": "BONAT",
        "sku_id": "refuel_full",
        "sku_kind": "fuel"
      },
      {
        "amount": 80,
        "currency": "BONAT",
        "sku_id": "fuel_unlimited_1h",
        "sku_kind": "fuel_unlimited"
      },
      {
        "amount": 400,
        "currency": "JENEHAT",
        "sku_id": "salon.nish",
        "sku_kind": "item"
      },
      {
        "amount": 150,
        "currency": "JENEHAT",
        "sku_id": "salon.sitara",
        "sku_kind": "item"
      },
      {
        "amount": 20,
        "currency": "BONAT",
        "sku_id": "revive",
        "sku_kind": "revive"
      },
      {
        "amount": 1500,
        "currency": "JENEHAT",
        "sku_id": "micro_old",
        "sku_kind": "vehicle"
      }
    ]
  },
  "chapters": [
    {
      "chapter_id": "ch1_first_job",
      "completion_bonat": 5,
      "goal": {
        "kind": "complete_line",
        "line_id": "line_hay"
      },
      "order": 1,
      "scenes": [
        {
          "panels": [
            {
              "art": "stand_morning",
              "lines": [
                {
                  "speaker": "usta",
                  "text": {
                    "ar-EG": "يا صباح الفل يا موقف"
                  }
                }
              ]
            },
            {
              "art": "salma_waiting",
              "lines": [
                {
                  "speaker": "salma",
                  "text": {
                    "ar-EG": "هو الميكروباص ده رايح الجامعة؟"
                  }
                }
              ]
            },
            {
              "art": "usta_decides",
              "lines": [
                {
                  "speaker": "usta",
                  "text": {
                    "ar-EG": "خلاص، من النهارده هحوّش قرش قرش"
                  }
                }
              ]
            }
          ],
          "scene_id": "the_stand"
        }
      ],
      "story_trip_id": "line_hay.03",
      "title": {
        "ar-EG": "أول شغلانة"
      }
    },
    {
      "chapter_id": "ch2_her_father",
      "completion_bonat": 10,
      "goal": {
        "kind": "own_vehicle",
        "vehicle_id": "micro_old"
      },
      "order": 2,
      "scenes": [],
      "title": {
        "ar-EG": "الكلام مع أبوها"
      }
    },
    {
      "chapter_id": "ch3_shabka",
      "completion_bonat": 10,
      "goal": {
        "kind": "purchase"
      },
      "order": 3,
      "scenes": [],
      "title": {
        "ar-EG": "الشبكة"
      }
    },
    {
      "chapter_id": "ch4_salon",
      "completion_bonat": 15,
      "goal": {
        "kind": "complete_room",
        "room_id": "salon"
      },
      "order": 4,
      "scenes": [],
      "title": {
        "ar-EG": "الصالون"
      }
    }
  ],
  "daily_rewards": [
    {
      "bonat": 0,
      "day_index": 1,
      "jenehat": 20
    },
    {
      "bonat": 0,
      "day_index": 2,
      "jenehat": 25
    },
    {
      "bonat": 0,
      "day_index": 3,
      "jenehat": 30
    },
    {
      "bonat": 0,
      "day_index": 4,
      "jenehat": 35
    },
    {
      "bonat": 0,
      "day_index": 5,
      "jenehat": 40
    },
    {
      "bonat": 0,
      "day_index": 6,
      "jenehat": 45
    },
    {
      "bonat": 5,
      "day_index": 7,
      "jenehat": 50
    }
  ],
  "family_requests": [
    {
      "item_id": "salon.nish",
      "request_id": "req_nish_crystal",
      "reward_bonat": 5,
      "room_id": "salon",
      "text": {
        "ar-EG": "مامة سلمى نفسها في النيش الكريستال"
      },
      "variant_id": "crystal"
    }
  ],
  "items": [
    {
      "item_id": "salon.nish",
      "name": {
        "ar-EG": "النيش"
      },
      "order": 1,
      "room_id": "salon",
      "variants": [
        {
          "art": "nish_classic",
          "name": {
            "ar-EG": "كلاسيك"
          },
          "variant_id": "classic"
        },
        {
          "art": "nish_crystal",
          "name": {
            "ar-EG": "كريستال"
          },
          "variant_id": "crystal"
        },
        {
          "art": "nish_modern",
          "name": {
            "ar-EG": "مودرن"
          },
          "variant_id": "modern"
        }
      ]
    },
    {
      "item_id": "salon.sitara",
      "name": {
        "ar-EG": "الستارة"
      },
      "order": 2,
      "room_id": "salon",
      "variants": [
        {
          "art": "sitara_plain",
          "name": {
            "ar-EG": "سادة"
          },
          "variant_id": "plain"
        }
      ]
    }
  ],
  "lines": [
    {
      "difficulty_band": {
        "max": 55,
        "min": 20
      },
      "line_id": "line_gamaa",
      "name": {
        "ar-EG": "خط الجامعة"
      },
      "order": 2,
      "stations": [
        {
          "name": {
            "ar-EG": "الكوبري"
          },
          "station_id": "kobri"
        },
        {
          "name": {
            "ar-EG": "المستشفى"
          },
          "station_id": "mostashfa"
        },
        {
          "name": {
            "ar-EG": "الجامعة"
          },
          "station_id": "gamaa"
        },
        {
          "name": {
            "ar-EG": "المكتبة"
          },
          "station_id": "maktaba"
        },
        {
          "name": {
            "ar-EG": "السور"
          },
          "station_id": "sour"
        }
      ],
      "unlock": {
        "kind": "vehicle",
        "vehicle_id": "micro_old"
      }
    },
    {
      "difficulty_band": {
        "max": 30,
        "min": 0
      },
      "line_id": "line_hay",
      "name": {
        "ar-EG": "خط الحي"
      },
      "order": 1,
      "stations": [
        {
          "name": {
            "ar-EG": "الميدان"
          },
          "station_id": "midan"
        },
        {
          "name": {
            "ar-EG": "المدرسة"
          },
          "station_id": "madrasa"
        },
        {
          "name": {
            "ar-EG": "الفرن"
          },
          "station_id": "forn"
        },
        {
          "name": {
            "ar-EG": "المحطة"
          },
          "station_id": "mahatta"
        }
      ],
      "unlock": {
        "kind": "start"
      }
    }
  ],
  "pack_id": "core",
  "rooms": [
    {
      "chapter_id": "ch4_salon",
      "completion_bonat": 20,
      "name": {
        "ar-EG": "الصالون"
      },
      "order": 1,
      "room_id": "salon"
    }
  ],
  "schema_version": "1.0",
  "speech_pools": [
    {
      "lines": [
        {
          "text": {
            "ar-EG": "إنت بتتهمني؟ أنا دافع يا أسطى!"
          }
        },
        {
          "text": {
            "ar-EG": "عيب كده، أنا دفعت"
          }
        }
      ],
      "speech_key": "passenger.accused"
    },
    {
      "lines": [
        {
          "text": {
            "ar-EG": "أيوه يا أسطى؟ معاك"
          }
        },
        {
          "text": {
            "ar-EG": "بتكلمني أنا؟"
          }
        }
      ],
      "speech_key": "passenger.attentive"
    },
    {
      "lines": [
        {
          "text": {
            "ar-EG": "السلام عليكم"
          }
        },
        {
          "text": {
            "ar-EG": "صباح الخير يا أسطى"
          }
        }
      ],
      "speech_key": "passenger.boards"
    },
    {
      "lines": [
        {
          "text": {
            "ar-EG": "خلاص خلاص، أهو دافع"
          }
        },
        {
          "text": {
            "ar-EG": "طب ماشي، اتفضل"
          }
        }
      ],
      "speech_key": "passenger.caught"
    },
    {
      "lines": [
        {
          "text": {
            "ar-EG": "معاك فكة {amount} يا أسطى؟"
          }
        },
        {
          "text": {
            "ar-EG": "ممكن تفكّلي {amount}؟"
          }
        }
      ],
      "speech_key": "passenger.change_request"
    },
    {
      "lines": [
        {
          "text": {
            "ar-EG": "ماشي، خلّيها"
          }
        },
        {
          "text": {
            "ar-EG": "يعني مفيش فكة خالص؟"
          }
        }
      ],
      "speech_key": "passenger.change_request_declined"
    },
    {
      "lines": [
        {
          "text": {
            "ar-EG": "أنا دافع يا أسطى!"
          }
        },
        {
          "text": {
            "ar-EG": "والله دفعت من بدري"
          }
        }
      ],
      "speech_key": "passenger.claims_paid"
    },
    {
      "lines": [
        {
          "text": {
            "ar-EG": "هو اللي ما دفعش!"
          }
        },
        {
          "text": {
            "ar-EG": "أنا دافع، اسأله هو"
          }
        }
      ],
      "speech_key": "passenger.dispute"
    },
    {
      "lines": [
        {
          "text": {
            "ar-EG": "نزّلني هنا يا أسطى"
          }
        },
        {
          "text": {
            "ar-EG": "على جنب هنا لو سمحت"
          }
        }
      ],
      "speech_key": "passenger.drop_me_here"
    },
    {
      "lines": [
        {
          "text": {
            "ar-EG": "يعني أنزل من غير باقي؟ لسه ليّا {amount}!"
          }
        },
        {
          "text": {
            "ar-EG": "فين الـ{amount} بتوعي يا أسطى؟"
          }
        }
      ],
      "speech_key": "passenger.fight"
    },
    {
      "lines": [
        {
          "text": {